<?xml version="1.0" encoding="UTF-8"?>
<company xmlns:xsi="http://www.w3.org/2001/XMLSchema-instance" xsi:noNamespaceSchemaLocation="companySchema.xsd">
    <employee id="101">
        <name>Rahul Sharma</name>
        <department>Engineering</department>
        <salary>95000</salary>
        <address>
            <street>Plot No. 45, MG Road</street>
            <city>Bengaluru</city>
            <state>KA</state>
            <zip>560001</zip>
        </address>
        <phone>080-12345678</phone>
        <email>rahul.sharma@gmail.in</email>
        <projects>
            <projectName>Project Vishal</projectName>
            <startDate>2023-04-01</startDate>
            <endDate>2024-03-31</endDate>
        </projects>
    </employee>
    <employee id="102">
        <name>Anjali Verma</name>
        <department>Marketing</department>
        <salary>90000</salary>
        <address>
            <street>No. 23, Gandhi Road</street>
            <city>Mumbai</city>
            <state>MH</state>
            <zip>400001</zip>
        </address>
        <phone>022-87654321</phone>
        <email>anjali.verma@pccoepune.org</email>
    </employee>
</company>
